{"audiences":["furatena.preview"],"authorization_endpoint":"https://auth.furatena.example/preview/authorize","binding":{"head_sha":"aaaaaaaaaaaaaaaaaaaaaaaaaaaaaaaaaaaaaaaa","origin":"https://pr-518.preview.example","pull_request_number":518,"repository_id":"repository-4242"},"created_at":"2030-01-01T00:00:00Z","deprecated_versions":[],"expires_at":"2030-01-08T00:00:00Z","grant_endpoint":"https://auth.furatena.example/preview/grants","issuer":"https://auth.furatena.example/preview","jwks_uri":"https://auth.furatena.example/preview/jwks.json","lifetimes":{"clock_skew_seconds":30,"code_seconds":120,"grant_seconds":300,"jwks_cache_seconds":300,"rollover_overlap_seconds":600,"session_seconds":3600},"record_type":"furatena.preview-auth.registration","redirect_paths":["/_fura/preview-auth/callback"],"registration_id":"aaaaaaaaaaaaaaaaaaaaaaaaaaaaaaaaaaaaaaaaaaa","revocation_endpoint":"https://auth.furatena.example/preview/revocations","schema_version":1,"supported_versions":[1]}
